"Level";"Name";"Type";"Cast Time";"Range";"Components";"Duration";"Description";"Source"
"5";"Flame Strike";"5th level Evocation";"1 action";"60 feet";"V, S, M";"Instantaneous";"(pinch of sulfur)A vertical column of divine fire roars down from the heavens in a location you specify. Each creature in a 10-foot radius, 40-foot-high cylinder centered on a point within range must make a Dexterity saving throw. A creature takes 4d6 fire damage and 4d6 radiant damage on a failed save, or half as much damage on a successful one.<br> <b>At Higher Levels</b>: When you cast this spell using a spell slot of 6th level or higher, the fire damage or the radiant damage (your choice) increases by 1d6 for each slot level above 5th. ";"Warlock (Efreeti)"
"5";"Bigby's Hand (appears as a tentacle)";"5th level Evocation";"1 action";"120 feet";"V, S, M";"Concentration, up to 1 minute";"(an eggshell and a snakeskin glove)You create a Large hand of shimmering, translucent force in an unoccupied space that you can see within range. The hand lasts for the spell's duration, and it moves at your command, mimicking the movements of your own hand.<br> The hand is an object that has AC 20 and hit points equal to your hit point maximum. If it drops to 0 hit points, the spell ends. It has a Strength of 26 (+8) and a Dexterity of 10 (+0). The hand doesn't fill its space.<br> When you cast the spell and as a bonus action on your subsequent turns, you can move the hand up to 60 feet and then cause one of the following effects with it.<br> <b>Clenched Fist</b>. The hand strikes one creature or object within 5 feet of it. Make a melee spell attack for the hand using your game statistics. On a hit, the target takes 4d8 force damage.<br> <b>Forceful Hand</b>. The hand attempts to push a creature within 5 feet of it in a direction you choose. Make a check with the hand's Strength contested by the Strength (Athletics) check of the target. If the target is Medium or smaller, you have advantage on the check. If you succeed, the hand pushes the target up to 5 feet plus a number of feet equal to five times your spellcasting ability modifier. The hand moves with the target to remain within 5 feet of it.<br> <b>Grasping Hand</b>. The hand attempts to grapple a Huge or smaller creature within 5 feet of it. You use the hand's Strength score to resolve the grapple. If the target is Medium or smaller, you have advantage on the check. While the hand is grappling the target, you can use a bonus action to have the hand crush it. When you do so, the target takes bludgeoning damage equal to 2d6 + your spellcasting ability modifier.<br> <b>Interposing Hand</b>. The hand interposes itself between you and a creature you choose until you give the hand a different command. The hand moves to stay between you and the target, providing you with half cover against the target. The target can't move through the hand's space if its Strength score is less than or equal to the hand's Strength score. If its Strength score is higher than the hand's Strength score, the target can move toward you through the hand's space, but that space is difficult terrain for the target.<br> <b>At Higher Levels</b>: When you cast this spell using a spell slot of 6th level or higher, the damage from the clenched fist option increases by 2d8 and the damage from the grasping hand increases by 2d6 for each slot level above 5th. ";"Warlock (Fathomless)"
"5";"Cone of Cold";"5th level Evocation";"1 action";"Self (60-foot cone)";"V, S, M";"Instantaneous";"(a small crystal or glass cone)A blast of cold air erupts from your hands. Each creature in a 60-foot cone must make a Constitution saving throw. A creature takes 8d8 cold damage on a failed save, or half as much damage on a successful one.<br> A creature killed by this spell becomes a frozen statue until it thaws.<br> <b>At Higher Levels</b>: When you cast this spell using a spell slot of 6th level or higher, the damage increases by 1d8 for each slot level above 5th. ";"Warlock (Fathomless)"
"5";"Creation";"5th level Illusion";"1 minute";"30 feet";"V, S, M";"Special";"(a tiny piece of matter of the same type of the item you plan to create)You pull wisps of shadow material from the Shadowfell to create a nonliving object of vegetable matter within range - soft goods, rope, wood, or something similar. You can also use this spell to create mineral objects such as stone, crystal, or metal. The object created must be no larger than a 5-foot cube, and the object must be of a form and material that you have seen before.<br> The duration depends on the object's material. If the object is composed of multiple materials, use the shortest duration.<br> <b>Duration</b>: Vegetable matter - 1 day. Stone/crystal - 12 hours. Precious metals - 1 hour. Gems - 10 minutes. Adamantine/Mithral - 1 minute.<br> Using any material created by this spell as another spell's material component causes that spell to fail.<br> <b>At Higher Levels</b>: When you cast this spell using a spell slot of 6th level or higher, the cube increases by 5 feet for each slot level above 5th. ";"Warlock (Genie)"
"5";"Cone of Cold";"5th level Evocation";"1 action";"Self (60-foot cone)";"V, S, M";"Instantaneous";"(a small crystal or glass cone)A blast of cold air erupts from your hands. Each creature in a 60-foot cone must make a Constitution saving throw. A creature takes 8d8 cold damage on a failed save, or half as much damage on a successful one.<br> A creature killed by this spell becomes a frozen statue until it thaws.<br> <b>At Higher Levels</b>: When you cast this spell using a spell slot of 6th level or higher, the damage increases by 1d8 for each slot level above 5th. ";"Warlock (Marid)"
"5";"Mislead";"5th level Illusion";"1 action";"Self";"S";"Concentration, up to 1 hour";"You become invisible at the same time that an illusory double of you appears where you are standing. The double lasts for the duration, but the invisibility ends if you attack or cast a spell.<br> You can use your action to move your illusory double up to twice your speed and make it gesture, speak, and behave in whatever way you choose.<br> You can see through its eyes and hear through its ears as if you were located where it is. On each of your turns as a bonus action, you can switch from using its senses to using your own, or back again. While you are using its senses, you are blinded and deafened in regard to your own surroundings. ";"Warlock (TCE)"
"5";"Planar Binding";"5th level Abjuration";"1 hour";"60 feet";"V, S, M";"24 hours";"(A jewel worth at least 1,000 gp, Consumed)With this spell, you attempt to bind a celestial, an elemental, a fey, or a fiend to your service. The creature must be within range for the entire casting of the spell. (Typically, the creature is first summoned into the center of an inverted <i>magic circle</i> in order to keep it trapped while this spell is cast.) At the completion of the casting, the target must make a Charisma saving throw. On a failed save, it is bound to serve you for the duration. If the creature was summoned or created by another spell, that spell's duration is extended to match the duration of this spell.<br> A bound creature must follow your instructions to the best of its ability. You might command the creature to accompany you on an adventure, to guard a location, or to deliver a message. The creature obeys the letter of your instructions, but if the creature is hostile to you, it strives to twist your words to achieve its own objectives. If the creature carries out your instructions completely before the spell ends, it travels to you to report this fact if you are on the same plane of existence. If you are on a different plane of existence, it returns to the place where you bound it and remains there until the spell ends.<br><br><b>At Higher Levels</b>: When you cast this spell using a spell slot of a higher level, the duration increases to 10 days with a 6th-level slot, to 30 days with a 7th-level slot, to 180 days with an 8th-level slot, and to a year and a day with a 9th-level spell slot. ";"Warlock (TCE)"
"5";"Teleportation Circle";"5th level Conjuration";"1 minute";"10 feet";"V, M";"1 round";"(Rare chalks and inks infused with precious gems with 50 gp, Consumed)As you cast the spell, you draw a 10-foot-diameter circle on the ground inscribed with sigils that link your location to a permanent teleportation circle of your choice whose sigil sequence you know and that is on the same plane of existence as you. A shimmering portal opens within the circle you drew and remains open until the end of your next turn. Any creature that enters the portal instantly appears within 5 feet of the destination circle or in the nearest unoccupied space if that space is occupied.<br> Many major temples, guilds, and other important places have permanent teleportation circles inscribed somewhere within their confines. Each such circle includes a unique sigil sequence - a string of magical runes arranged in a particular pattern. When you first gain the ability to cast this spell, you learn the sigil sequences for 2 destinations on the Material Plane, determined by the DM. You can learn additional sigil sequences during your adventures. You can commit a new sigil sequence to memory after studying it for 1 minute.<br> You can create a permanent teleportation circle by casting this spell in the same location every day for 1 year. You need not use the circle to teleport when you cast the spell in this way. ";"Warlock (TCE)"
"6";"Arcane Gate";"6th level Conjuration";"1 action";"500 feet";"V, S";"Concentration, up to 10 minutes";"You create linked teleportation portals that remain open for the duration. Choose two points on the ground that you can see, one point within 10 feet of you and one point within 500 feet of you. A circular portal, 10 feet in diameter, opens over each point. If the portal would open in the space occupied by a creature, the spell fails, and the casting is lost.<br> The portals are two-dimensional glowing rings filled with mist, hovering inches from the ground and perpendicular to it at the points you choose. A ring is visible only from one side (your choice), which is the side that functions as a portal.<br> Any creature or object entering the portal exits from the other portal as if the two were adjacent to each other, passing through a portal from the non-portal side has no effect. The mist that fills each portal is opaque and blocks vision through it. On your turn, you can rotate the rings as a bonus action so that the active side faces in a different direction. ";"Warlock"
"6";"Circle of Death";"6th level Necromancy";"1 action";"150 feet";"V, S, M";"Instantaneous";"(the powder of a crushed black pearl worth at least 500 gp)A sphere of negative energy ripples out in a 60-foot-radius sphere from a point within range. Each creature in that area must make a Constitution saving throw. A target takes 8d6 necrotic damage on a failed save, or half as much damage on a successful one.<br> <b>At Higher Levels</b>: When you cast this spell using a spell slot of 7th level or higher, the damage increases by 2d6 for each slot level above 6th. ";"Warlock"
"6";"Conjure Fey";"6th level Conjuration";"1 minute";"90 feet";"V, S";"Concentration, up to 1 hour";"You summon a fey creature of challenge rating 6 or lower, or a fey spirit that takes the form of a beast of challenge rating 6 or lower. It appears in an unoccupied space that you can see within range. The fey creature disappears when it drops to 0 hit points or when the spell ends.<br> The fey creature is friendly to you and your companions for the duration. Roll initiative for the creature, which has its own turns. It obeys any verbal commands that you issue to it (no action required by you), as long as they don't violate its alignment. If you don't issue any commands to the fey creature, it defends itself from hostile creatures but otherwise takes no actions.<br> If your concentration is broken, the fey creature doesn't disappear. Instead, you lose control of the fey creature, it becomes hostile toward you and your companions, and it might attack. An uncontrolled fey creature can't be dismissed by you, and it disappears 1 hour after you summoned it.<br> The DM has the fey creature's statistics.<br <b>At Higher Levels</b>: When you cast this spell using a spell slot of 7th level or higher, the challenge rating increases by 1 for each slot level above 6th. ";"Warlock"
"6";"Create Undead";"6th level Necromancy";"1 minute";"10 feet";"V, S, M";"Instantaneous";"(one clay pot filled with grave dirt, one clay pot filled with brackish water, and one 150 gp black onyx stone for each corpse.)You can cast this spell only at night. Choose up to three corpses of Medium or Small humanoids within range. Each corpse becomes a ghoul under your control. (The DM has game statistics for these creatures.)<br> As a bonus action on each of your turns, you can mentally command any creature you animated with this spell if the creature is within 120 feet of you (if you control multiple creatures, you can command any or all of them at the same time, issuing the same command to each one). You decide what action the creature will take and where it will move during its next turn, or you can issue a general command, such as to guard a particular chamber or corridor. If you issue no commands, the creature only defends itself against hostile creatures. Once given an order, the creature continues to follow it until its task is complete.<br> The creature is under your control for 24 hours, after which it stops obeying any command you have given it. To maintain control of the creature for another 24 hours, you must cast this spell on the creature before the current 24-hour period ends. This use of the spell reasserts your control over up to three creatures you have animated with this spell, rather than animating new ones.<br> <b>At Higher Levels</b>: When you cast this spell using a 7th-level spell slot, you can animate or reassert control over four ghouls. When you cast this spell using an 8th-level spell slot, you can animate or reassert control over five ghouls or two ghasts or wights. When you cast this spell using a 9th-level spell slot, you can animate or reassert control over six ghouls, three ghasts or wights, or two mummies ";"Warlock"
"6";"Eyebite";"6th level Necromancy";"1 action";"Self";"V, S";"Concentration, up to 1 minute";"For the spell's duration, your eyes become an inky void imbued with dread power. One creature of your choice within 60 feet of you that you can see must succeed on a Wisdom saving throw or be affected by one of the following effects of your choice for the duration. On each of your turns until the spell ends, you can use your action to target another creature but can't target a creature again if it has succeeded on a saving throw against this casting of <i>eyebite</i>.<br> <b>Asleep</b>: The target falls unconscious. It wakes up if it takes any damage or if another creature uses its action to shake the sleeper awake.<br> <b>Panicked</b>: The target is frightened of you. On each of its turns, the frightened creature must take the Dash action and move away from you by the safest and shortest available route, unless there is nowhere to move. If the target moves to a place at least 60 feet away from you where it can no longer see you, this effect ends.<br> <b>Sickened</b>: The target has disadvantage on attack rolls and ability checks. At the end of each of its turns, it can make another Wisdom saving throw. If it succeeds, the effect ends. ";"Warlock"
"6";"Flesh to Stone";"6th level Transmutation";"1 action";"60 feet";"V, S, M";"Concentration, up to 1 minute";"(a pinch of lime, water, and earth)You attempt to turn one creature that you can see within range into stone. If the targets body is made of flesh, the creature must make a Constitution saving throw. On a failed save, it is restrained as its flesh begins to harden. On a successful save, the creature isn't affected.<br> A creature restrained by this spell must make another Constitution saving throw at the end of each of its turns. If it successfully saves against this spell three times, the spell ends. If it fails saves three times, it is turned to stone and subjected to the petrified condition for the duration. The successes and failures don't need to be consecutive, keep track of both until the target collects three of a kind.<br> If the creature is physically broken while petrified, it suffers from similar deformities if it reverts to its original state.<br> If you maintain your concentration on this spell for the entire possible duration, the creature is turned to stone until the effect is removed. ";"Warlock"
"6";"Investiture of Flame";"6th level Transmutation";"1 action";"Self";"V, S";"Concentration, up to 10 minutes";"Flames race across your body, shedding bright light in a 30-foot radius and dim light for an additional 30 feet for the spell's duration. The flames don't harm you. Until the spell ends, you gain the following benefits:<br> • You are immune to fire damage and have resistance to cold damage.<br> • Any creature that moves within 5 feet of you for the first time on a turn or ends its turn there takes 1d10 fire damage.<br> • You can use your action to create a line of fire 15 feet long and 5 feet wide extending from you in a direction you choose. Each creature in the line must make a Dexterity saving throw. A creature takes 4d8 fire damage on a failed save, or half as much damage on a successful one.";"Warlock (XGE)"
"6";"Investiture of Ice";"6th level Transmutation";"1 action";"Self";"V, S";"Concentration, up to 10 minutes";"Until the spell ends, ice rimes your body, and you gain the following benefits:<br> • You are immune to cold damage and have resistance to fire damage.<br> • You can move across difficult terrain created by ice or snow without spending extra movement.<br> • The ground in a 10-foot radius around you is icy and is difficult terra in for creatures other than you. The radius moves with you.<br> • You can use your action to create a 15-foot cone of freezing wind extending from your outstretched hand in a direction you choose. Each creature in the cone must make a Constitution saving throw. A creature takes 4d6 cold damage on a failed save, or half as much da mage on a successful one. A creature that fails its save against this effect has its speed halved until the start of your next turn.";"Warlock (XGE)"
"6";"Investiture of Stone";"6th level Transmutation";"1 action";"Self";"V, S";"Concentration, up to 10 minutes";"Until the spell ends, bits of rock spread across your body, and you gain the following benefits:<br> • You have resistance to bludgeoning, piercing, and slashing damage from nonmagical attacks.<br> • You can use your action to create a small earthquake on the ground in a 15-foot radius centered on you. Other creatures on that ground must succeed on a Dexterity saving throw or be knocked prone.<br> • You can move across difficult terrain made of earth or stone without spending extra movement. You can move through solid earth or stone as if it was air and without destabilizing it, but you can't end your movement there. If you do so, you are ejected to the nearest unoccupied space, this spell ends, and you are stunned until the end of your next turn.";"Warlock (XGE)"
"6";"Investiture of Wind";"6th level Transmutation";"1 action";"Self";"V, S";"Concentration, up to 10 minutes";"Until the spell ends, wind whirls around you, and you gain the following benefits:<br>  • Ranged weapon attacks made against you have disadvantage on the attack roll.<br> • You gain a flying speed of 60 feet. If you are still flying when the spell ends, you fall, unless you can somehow prevent it.<br> • You can use your action to create a 15-foot cube of swirling wind centered on a point you can see within 60 feet ofyou. Each creature in that area must make a Constitution saving throw. A creature takes 2d10 bludgeoning damage on a failed save, or half as much damage on a successful one. If a Large or smaller creature fails the save, that creature is also pushed up to 10 feet away from the center of the cube.";"Warlock (XGE)"
"6";"Mass Suggestion";"6th level Enchantment ";"1 action";"60 feet";"V, M";"24 hours";"(a snake's tongue and either a bit of honeycomb or a drop of sweet oil)You suggest a course of activity (limited to a sentence or two) and magically influence up to twelve creatures of your choice that you can see within range and that can hear and understand you. Creatures that can't be charmed are immune to this effect. The suggestion must be worded in such a manner as to make the course of action sound reasonable. Asking the creature to stab itself, throw itself onto a spear, immolate itself, or do some other obviously harmful act automatically negates the effect of the spell.<br> Each target must make a Wisdom saving throw. On a failed save, it pursues the course of action you described to the best of its ability. The suggested course of action can continue for the entire duration. If the suggested activity can be completed in a shorter time, the spell ends when the subject finishes what it was asked to do.<br> You can also specify conditions that will trigger a special activity during the duration. For example, you might suggest that a group of soldiers give all their money to the first beggar they meet. If the condition isn't met before the spell ends, the activity isn't performed.<br> If you or any of your companions damage a creature affected by this spell, the spell ends for that creature.<br> <b>At Higher Levels</b>: When you cast this spell using a 7th-level spell slot, the duration is 10 days. When you use an 8th-level spell slot, the duration is 30 days. When you use a 9th-level spell slot, the duration is a year and a day. ";"Warlock"
"6";"Mental Prison";"6th level Illusion";"1 action";"60 feet";"S";"Concentration, up to 1 minute";"You attempt to bind a creature within an illusory cell that only it perceives. One creature you can see within range must make an Intelligence saving throw. The target succeeds automatically if it is immune to being charmed. On a successful save, the target takes 5d10 psychic damage, and the spell ends. On a failed save, the target takes 5d10 psychic damage, and you make the area immediately around the target's space appear dangerous to it in some way. You might cause the target to perceive itself as being surrounded by fire, floating razors, or hideous maws filled with dripping teeth. Whatever form the illusion takes, the target can't see or hear anything beyond it and is restrained for the spell's duration. If the target is moved out of the illusion, makes a melee attack through it, or reaches any part of its body through it, the target takes 10d10 psychic damage, and the spell ends.";"Warlock (XGE)"
"6";"Scatter";"6th level Conjuration";"1 action";"30 feet";"V";"Instantaneous";"The air quivers around up to five creatures of your choice that you can see within range. An unwilling creature must succeed on a Wisdom saving throw to resist this spell. You teleport each affected target to an unoccupied space that you can see within 120 feet of you. That space must be on the ground or on a floor.";"Warlock (XGE)"
"6";"Soul Cage";"6th level Necromancy";"1 reaction, which you take when a humanoid you can see within 60 feet of you dies";"60 feet";"V, S, M";"8 hours";"(a tiny silver cage worth 100 gp)This spell snatches the soul of a humanoid as it dies and traps it inside the tiny cage you use for the material component. A stolen soul remains inside the cage until the spell ends or until you destroy the cage, which ends the spell. While you have a soul inside the cage, you can exploit it in any of the ways described below. You can use a trapped soul up to six times. Once you exploit a soul for the sixth time, it is released, and the spell ends. While a soul is trapped, the dead humanoid it came from can't be revived.<br> <b>Steal Life</b>: You can use a bonus action to drain vigor from the soul and regain 2d8 hit points.<br> <b> Query Soul</b>: You ask the soul a question (no action required) and receive a brief telepathic answer, which you can understand regardless of the language used. The soul knows only what it knew in life, but it must answer you truthfully and to the best of its ability. The answer is no more than a sentence or two and might be cryptic.<br> <b> Borrow Experience</b>: You can use a bonus action to bolster yourself with the soul's life experience, making your next attack roll, ability check, or saving throw with advantage. If you don't use this benefit before the start of your next turn, it is lost.<br> <b> Eyes of the Dead</b>: You can use an action to name a place the humanoid saw in life, which creates an invisible sensor somewhere in that place if it is on the plane of existence you're currently on. The sensor remains for as long as you concentrate, up to 10 minutes (as if you were concentrating on a spell). You receive visual and auditory information from the sensor as if you were in its space using your senses.<br> A creature that can see the sensor (such as one using <i>see invisibility</i> or truesight) sees a translucent image of the tormented humanoid whose soul you caged.";"Warlock (XGE)"
