"Level";"Name";"Type";"Cast Time";"Range";"Components";"Duration";"Description";"Source"
"0";"Blade Ward";"Abjuration cantrip";"1 action";"Self";"V, S";"1 round";"You extend your hand and trace a sigil of warding in the air. Until the end of your next turn, you have resistance against bludgeoning, piercing, and slashing damage dealt by weapon attacks.";"Warlock"
"0";"Booming Blade";"Evocation cantrip";"1 action";"Self (5-foot radius)";"S, M";"1 round";"(a melee weapon worth at least 1 sp)You brandish the weapon used in the spell's casting and make a melee attack with it against one creature within 5 feet of you. On a hit, the target suffers the weapon attack's normal effects and then becomes sheathed in booming energy until the start of your next turn. If the target willingly moves 5 feet or more before then, the target takes 1d8 thunder damage, and the spell ends.<br>At Higher Levels. At 5th level, the melee attack deals an extra 1d8 thunder damage to the target on a hit, and the damage the target takes for moving increases to 2d8. Both damage rolls increase by 1d8 at 11th level (2d8 and 3d8) and again at 17th level (3d8 and 4d8).";"Warlock (TCE)"
"0";"Booming Blade";"Evocation cantrip";"1 action";"5 feet";"V, M";"1 round";"(a weapon)As part of the action used to cast this spell, you must make a melee attack with a weapon against one creature within the spell's range, otherwise the spell fails. On a hit, the target suffers the attack's normal effects, and it becomes sheathed in booming energy until the start of your next turn. If the target willingly moves before then, it immediately takes 1d8 thunder damage, and the spell ends.<br> This spell's damage increases when you reach higher levels. At 5th level, the melee attack deals an extra 1d8 thunder damage to the target, and the damage the target takes for moving increases to 2d8. Both damage rolls increase by 1d8 at 11th level and 17th level.";"Warlock (SCAG)"
"0";"Chill Touch";"Necromancy cantrip";"1 action";"120 feet";"V, S";"1 round";"You create a ghostly, skeletal hand in the space of a creature within range. Make a ranged spell attack against the creature to assail it with the chill of the grave. On a hit, the target takes 1d8 necrotic damage, and it can't regain hit points until the start of your next turn. Until then, the hand clings to the target.<br> If you hit an undead target, it also has disadvantage on attack rolls against you until the end of your next turn.<br> This spell's damage increases by 1d8 when you reach 5th level (2d8), 11th level (3d8), and 17th level (4d8). ";"Warlock"
"0";"Create Bonfire";"Conjuration cantrip";"1 action";"60 feet";"V, S";"Concentration, up to 1 minute";"You create a bonfire on ground that you can see within range. Until the spells ends, the magic bonfire fills a 5-foot cube. Any creature in the bonfire's space when you cast the spell must succeed on a Dexterity saving throw or take 1d8 fire damage. A creature must also make the saving throw when it enters the bonfire's space for the first time on a turn or ends its turn there.<br> The bonfire ignites flammable objects in its area that aren't being worn or carried.<br> The spell's damage increases by 1d8 when you reach 5th level (2d8), 11th level (3d8), and 17th level (4d8).";"Warlock (XGE)"
"0";"Eldritch Blast";"Evocation cantrip";"1 action";"120 feet";"V, S";"Instantaneous";"A beam of crackling energy streaks toward a creature within range. Make a ranged spell attack against the target. On a hit, the target takes 1d10 force damage.<br> The spell creates more than one beam when you reach higher levels - two beams at 5th level, three beams at 11th level, and four beams at 17th level. you can direct the beams at the same target or at different ones. Make a separate attack roll for each beam. ";"Warlock"
"0";"Friends";"Enchantment  cantrip";"1 action";"Self";"S, M";"Concentration, up to 1 minute";"For the duration, you have advantage on all Charisma checks directed at one creature of your choice that isn't hostile toward you. When the spell ends, the creature realizes that you used magic to influence its mood and becomes hostile toward you. A creature prone to violence might attack you. Another creature might seek retribution in other ways (at the DM's discretion), depending on the nature of your interaction with it.";"Warlock"
"0";"Frostbite";"Evocation cantrip";"1 action";"60 feet";"V, S";"Instantaneous";"You cause numbing frost to form on one creature that you can see within range. The target must make a Constitution saving throw. On a failed save, the target takes 1d6 cold damage, and it has disadvantage on the next weapon attack roll it makes before the end of its next turn.<br> The spell's damage increases by 1d6 when you reach 5th level (2d6), 11th level (3d6), and 17th level (4d6).";"Warlock (XGE)"
"0";"Green-Flame Blade";"Evocation cantrip";"1 action";"Self (5-foot radius)";"S, M";"Instantaneous";"(a melee weapon worth at least 1 sp)You brandish the weapon used in the spell's casting and make a melee attack with it against one creature within 5 feet of you. On a hit, the target suffers the weapon attack's normal effects, and you can cause green fire to leap from the target to a different creature of your choice that you can see within 5 feet of it. The second creature takes fire damage equal to your spellcasting ability modifier.<br>At Higher Levels. At 5th level, the melee attack deals an extra 1d8 fire damage to the target on a hit, and the fire damage to the second creature increases to 1d8 + your spellcasting ability modifier. Both damage rolls increase by 1d8 at 11th level (2d8 and 2d8) and 17th level (3d8 and 3d8).";"Warlock (TCE)"
"0";"Green-Flame Blade";"Evocation cantrip";"1 action";"5 feet";"V, M";"1 round";"(a weapon)As part of the action used to cast this spell, you must make a melee attack with a weapon against one creature within the spell's range, otherwise the spell fails. On a hit, the target suffers the attack's normal effects, and green fire leaps from the target to a different creature of your choice that you can see within 5 feet of it. The second creature takes fire damage equal to your spellcasting ability modifier.<br> This spell's damage increases when you reach higher levels. At 5th level, the melee attack deals an extra 1d8 fire damage to the target, and the fire damage to the second creature increases to 1d8 + your spellcasting ability modifier. Both damage rolls increase by 1d8 at 11th level and 17th level.";"Warlock (SCAG)"
"0";"Infestation";"Conjuration cantrip";"1 action";"30 feet";"V, S, M";"Instantaneous";"(a living flea)You cause a cloud of mites, fleas, and other parasites to appear momentarily on one creature you can see within range. The target must succeed on a Constitution saving throw, or it takes 1d6 poison damage and moves 5 feet in a random direction if it can move and its speed is at least 5 feet. Roll a d4 for the direction: 1, north: 2, south: 3, east: or 4, west. This movement doesn't provoke opportunity attacks, and if the direction rolled is blocked, the target doesn't move.<br> The spell's damage increases by 1d6 when you reach 5th level (2d6), 11th level (3d6), and 17th level (4d6).";"Warlock (XGE)"
"0";"Lightning Lure";"Evocation cantrip";"1 action";"Self (15-foot radius)";"V";"Instantaneous";"You create a lash of lightning energy that strikes at one creature of your choice that you can see within 15 feet of you. The target must succeed on a Strength saving throw or be pulled up to 10 feet in a straight line toward you and then take 1d8 lightning damage if it is within 5 feet of you.<br><b>At Higher Levels</b>: This spell's damage increases by 1d8 when you reach 5th level (2d8), 11th level (3d8), and 17th level (4d8).";"Warlock (TCE)"
"0";"Lightning Lure";"Evocation cantrip";"1 action";"15 feet";"V";"Instantaneous";"You create a lash of lightning energy that strikes at one creature of your choice that you can see within range. The target must succeed on a Strength saving throw or be pulled up to 10 feet in a straight line toward you and then take 1d8 lightning damage if it is within 5 feet of you.<br> The spell's damage increases by 1d8 when you reach 5th level (2d8), 11th level (3d8), and 17th level (4d8).";"Warlock (SCAG)"
"0";"Mage Hand";"Conjuration cantrip";"1 action";"30 feet";"V, S";"1 minute";"A spectral, floating hand appears at a point you choose within range. The hand lasts for the duration or until you dismiss it as an action. The hand vanishes if it is ever more than 30 feet away from you or if you cast this spell again.<br> You can use your action to control the hand. You can use the hand to manipulate an object, open an unlocked door or container, stow or retrieve an item from an open container, or pour the contents out of a vial. You can move the hand up to 30 feet each time you use it.<br> The hand can't attack, activate magical items, or carry more than 10 pounds. ";"Warlock"
"0";"Magic Stone";"Transmutation cantrip";"1 bonus action";"Touch";"V, S";"1 minute";"You touch one to three pebbles and imbue them with magic. You or someone else can make a ranged spell attack with one of the pebbles by throwing it or hurling it with a sling. lf thrown, a pebble has a range of 60 feet. If someone else attacks with a pebble, that attacker adds your spellcasting ability modifier, not the attacker's, to the attack roll. On a hit, the target takes bludgeoning damage equal to 1d6 +your spellcasting ability modifier. Whether the attack hits or misses, the spell then ends on the stone.<br> If you cast this spell again, the spell ends on any pebbles still affected by your previous casting.";"Warlock (XGE)"
"0";"Mind Sliver";"Enchantment cantrip";"1 action";"60 feet";"V";"1 round";"You drive a disorienting spike of psychic energy into the mind of one creature you can see within range. The target must succeed on an Intelligence saving throw or take 1d6 psychic damage and subtract 1d4 from the next saving throw it makes before the end of your next turn.<br><b>At Higher Levels</b>: This spell's damage increases by 1d6 when you reach certain levels: 5th level (2d6), 11th level (3d6), and 17th level (4d6).";"Warlock (TCE)"
"0";"Minor Illusion";"Illusion cantrip";"1 action";"30 feet";"S, M";"1 minute";"You create a sound or an image of an object within range that lasts for the duration. The illusion also ends if you dismiss it as an action or cast this spell again.<br> If you create a sound, its volume can range from a whisper to a scream. It can be your voice, someone else's voice, a lion's roar, a beating of drums, or any other sound you choose. The sound continues unabated throughout the duration, or you can make discrete sounds at different times before the spell ends.<br> If you create an image of an object - such as a chair, muddy footprints, or a small chest - it must be no larger than a 5-foot cube. The image can't create sound, light, smell, or any other sensory effect. Physical interaction with the image reveals it to be an illusion, because things can pass through it.<br> If a creature uses its action to examine the sound or image, the creature can determine that it is an illusion with a successful Intelligence (Investigation) check against your spell save DC. If a creature discerns the illusion for what it is, the illusion becomes faint to the creature. ";"Warlock"
"0";"Poison Spray";"Conjuration cantrip";"1 action";"10 feet";"V, S";"Instantaneous";"You extend your hand toward a creature you can see within range and project a puff of noxious gas from your palm. The creature must succeed on a Constitution saving throw or take 1d12 poison damage.<br> This spell's damage increases by 1d12 when you reach 5th level (2d12), 11th level (3d12), and 17 level (4d12). ";"Warlock"
"0";"Prestidigitation";"Transmutation cantrip";"1 action";"10 feet";"V, S";"Up to 1 hour";"This spell is a minor magical trick that novice spellcasters use for practice. You create one of the following magical effects within range.<br> • You create an instantaneous, harmless sensory effect, such as a shower of sparks, a puff of wind, faint musical notes, or an odd odor.<br> • You instantaneously light or snuff out a candle, a torch, or a small campfire.<br> • You instantaneously clean or soil an object no larger than 1 cubic foot.<br> • You chill, warm, or flavor up to 1 cubic foot of nonliving material for 1 hour.<br> • You make a color, a small mark, or a symbol appear on an object or a surface for 1 hour.<br> • You create a nonmagical trinket or an illusory image that can fit in your hand and that lasts until the end of your next turn.<br> If you cast this spell multiple times, you can have up to three of its non-instantaneous effects active at a time, and you can dismiss such an effect as an action. ";"Warlock"
"0";"Sword Burst";"Conjuration cantrip";"1 action";"Self (5-foot radius)";"V";"Instantaneous";"You create a momentary circle of spectral blades that sweep around you. All other creatures within 5 feet of you must succeed on a Dexterity saving throw or take 1d6 force damage.<br><b>At Higher Levels</b>: This spell's damage increases by 1d6 when you reach 5th level (2d6), 11th level (3d6), and 17th level (4d6).";"Warlock (TCE)"
"0";"Sword Burst";"Conjuration cantrip";"1 action";"5 feet";"V";"Instantaneous";"You create a momentary circle of spectral blades that sweep around you. Each creature within range, other than you, must succeed on a Dexterity saving throw or take 1d6 force damage.<br> The spell's damage increases by 1d6 when you reach 5th level (2d6), 11th level (3d6), and 17th level (4d6).";"Warlock (SCAG)"
"0";"Thunderclap";"Evocation cantrip";"1 action";"5 feet";"S";"Instantaneous";"You create a burst of thunderous sound that can be heard up to 100 feet away. Each creature within range, other than you, must make a Constitution saving throw or take 1d6 thunder damage.<br> The spell's damage increases by 1d6 when you reach 5th level (2d6), 11th level (3d6), and 17th level (4d6).";"Warlock (XGE)"
"0";"Toll the Dead";"Necromancy cantrip";"1 action";"60 feet";"V, S";"Instantaneous";"You point at one creature you can see within range, and the sound of a dolorous bell fills the air around it for a moment. The target must succeed on a Wisdom saving throw or take ld8 necrotic damage. If the target is missing any of its hit points, it instead takes 1d12 necrotic damage.<br> The spell's damage increases by one die when you reach 5th level (2d8 or 2d12), 11th level (3d8 or 3d12), and 17th level (4d8 or 4d12).";"Warlock (XGE)"
"0";"True Strike";"Divination cantrip";"1 action";"30 feet";"S";"Concentration, up to 1 round";"You extend your hand and point a finger at a target in range. Your magic grants you a brief insight into the target's defenses. On your next turn, you gain advantage on your first attack roll against the target, provided that this spell hasn't ended.";"Warlock"
"1";"Armor of Agathys";"1st level Abjuration";"1 action";"Self";"V, S, M";"1 hour";"(a cup of water)A protective magical force surrounds you, manifesting as a spectral frost that covers you and your gear. You gain 5 temporary hit points for the duration. If a creature hits you with a melee attack while you have these hit points, the creature takes 5 cold damage.<br> <b>At Higher Levels</b>: When you cast this spell using a spell slot of 2nd level or higher, both the temporary hit points and the cold damage increase by 5 for each slot level above 1st. ";"Warlock"
"1";"Arms of Hadar";"1st level Conjuration";"1 action";"Self (10-foot radius)";"V, S";"Instantaneous";"You invoke the power of Hadar, the Dark Hunger. Tendrils of dark energy erupt from you and batter all creatures within 10 feet of you. Each creature in that area must make a Strength saving throw. On a failed save, a target takes 2d6 necrotic damage and can't take reactions until its next turn. On a successful save, the creature takes half damage, but suffers no other effect.<br> <b>At Higher Levels</b>: When you cast this spell using a spell slot of 2nd level or higher, the damage increases by 1d6 for each slot level above 1st. ";"Warlock"
"1";"Burning Hands";"1st level Evocation";"1 action";"Self (15-foot cone)";"V, S";"Instantaneous";"As you hold your hands with thumbs touching and fingers spread, a thin sheet of flames shoots forth from your outstretched fingertips. Each creature in a 15-foot cone must make a Dexterity saving throw. A creature takes 3d6 fire damage on a failed save, or half as much damage on a successful one.<br> The fire ignites any flammable objects in the area that aren't being worn or carried.<br> <b>At Higher Levels</b>: When you cast this spell using a spell slot of 2nd level or higher, the damage increases by 1d6 for each slot level above 1st. ";"Warlock (Fiend)"
"1";"Cause Fear";"1st level Necromancy";"1 action";"60 feet";"V";"Concentration, up to 1 minute";"You awaken the sense of mortality in one creature you can see within range. A construct or an undead is immune to this effect. The target must succeed on a Wisdom saving throw or become frightened of you until the spell ends. The frightened target can repeat the saving throw at the end of each of its turns, ending the effect on itself on a success.<br> <b>At Higher Levels</b>: When you cast this spell using a spell slot of 2nd level or higher, you can target one additional creature for each slot level above 1st. The creatures must be within 30 feet of each other when you target them.";"Warlock (XGE)"
"1";"Charm Person";"1st level Enchantment ";"1 action";"30 feet";"V, S";"1 hour";"You attempt to charm a humanoid you can see within range. It must make a Wisdom saving throw, and does so with advantage if you or your companions are fighting it. If it fails the saving throw, it is charmed by you until the spell ends or until you or your companions do anything harmful to it. The charmed creature regards you as a friendly acquaintance. When the spell ends, the creature knows it was charmed by you.<br> <b>At Higher Levels</b>: When you cast this spell using a spell slot of 2nd level or higher, you can target one additional creature for each slot level above 1st. The creatures must be within 30 feet of each other when you target them. ";"Warlock"
"1";"Command";"1st level Enchantment ";"1 action";"60 feet";"V";"1 round";"You speak a one-word command to a creature you can see within range. The target must succeed on a Wisdom saving throw or follow the command on its next turn. The spell has no effect if the target is undead, if it doesn't understand your language, or if your command is directly harmful to it.<br> Some typical commands and their effects follow.<br> You might issue a command other than one described here. If you do so, the DM determines how the target behaves. If the target can't follow your command, the spell ends.<br> <b>Approach</b>: The target moves toward you by the shortest and most direct route, ending its turn if it moves within 5 feet of you.<br> <b>Drop</b>: The target drops whatever it is holding and then ends its turn.<br> <b>Flee</b>: The target spends its turn moving away from you by the fastest available means.<br> <b>Grovel</b>: The target falls prone and then ends its turn.<br> <b>Halt</b>: The target doesn't move and takes no actions. A flying creature stays aloft, provided that it is able to do so. If it must move to stay aloft, it flies the minimum distance needed to remain in the air.<br> <b>At Higher Levels</b>: When you cast this spell using a spell slot of 2nd level or higher, you can affect one additional creature for each slot level above 1st. The creatures must be within 30 feet of each other when you target them. ";"Warlock (Fiend)"
"1";"Comprehend Languages (ritual)";"1st level Divination";"1 action";"Self";"V, S, M";"1 hour";"(a pinch of soot and salt)For the duration, you understand the literal meaning of any spoken language that you hear. You also understand any spoken language that you hear. You also understand any written language that you see, but you must be touching the surface of which the words are written. It takes about 1 minute to read one page of text.<br> This spell doesn't decode secret messages in a text or glyph, such as an arcane sigil, that isn't part of a written language. ";"Warlock"
"1";"Dissonant Whispers";"1st level Enchantment ";"1 action";"60 feet";"V";"Instantaneous";"You whisper a discordant melody that only one creature of your choice within range can hear, wracking it with terrible pain. The target must make a Wisdom saving throw. On a failed save, it takes 3d6 psychic damage and must immediately use its reaction, if available, to move as far as its speed allows away from you. The creature doesn't move into obviously dangerous ground, such as a fire or a pit. On a successful save, the target takes half as much damage and doesn't have to move away. A deafened creature automatically succeeds on the save.<br> <b>At Higher Levels</b>: When you cast this spell using a spell slot of 2nd level or higher, the damage increases by 1d6 for each slot level above 1st. ";"Warlock (Great Old One)"
"1";"Expeditious Retreat";"1st level Transmutation";"1 bonus action";"Self";"V, S";"Concentration, up to 10 minutes";"This spell allows you to move at an incredible pace. When you cast this spell, and then as a bonus action on each of your turns until the spell ends, you can take the Dash action.";"Warlock"
"1";"Faerie Fire";"1st level Evocation";"1 action";"60 feet";"V";"Concentration, up to 1 minute";"Each object in a 20-foot cube within range is outlined in blue, green, or violet light (your choice). Any creature in the area when the spell is cast is also outlined in light if it fails a Dexterity saving throw. For the duration, objects and affected creatures shed dim light in a 10-foot radius.<br> Any attack roll against an affected creature or object has advantage if the attacker can see it, and the affected creature or object can't benefit from being invisible. ";"Warlock (Archfey)"
"1";"False Life";"1st level Necromancy";"1 action";"Self";"V, S, M";"1 hour";"(a small amount of alcohol or distilled spirits)Bolstering yourself with a necromantic facsimile of life, you gain 1d4+4 temporary hit points for the duration.<br> <b>At Higher Levels</b>: When you cast this spell using a spell slot of 2nd level or higher, you gain 5 additional temporary hit points for each slot level above 1st. ";"Warlock (Undying)"
"1";"Guiding Bolt";"1st level Evocation";"1 action";"120 feet";"V, S";"1 round";"A flash of light streaks toward a creature of your choice within range. Make a ranged spell attack against the target. On a hit, the target takes 4d6 radiant damage, and the next attack roll made against this target before the end of your next turn has advantage, thanks to the mystical dim light glittering on the target until then.<br> <b>At Higher Levels</b>: When you cast this spell using a spell slot of 2nd level or higher, the damage increases by 1d6 for each slot level above 1st. ";"Warlock"
"1";"Hellish Rebuke";"1st level Evocation";"1 reaction";"60 feet";"V, S";"Instantaneous";"You point your finger, and the creature that damaged you is momentarily surrounded by hellish flames. The creature must make a Dexterity saving throw. It takes 2d10 fire damage on a failed save, or half as much damage on a successful one.<br> <b>At Higher Levels</b>: When you cast this spell using a spell slot of 2nd level or higher, the damage increases by 1d10 for each slot level above 1st. ";"Warlock"
"1";"Hex";"1st level Enchantment ";"1 bonus action";"90 feet";"V, S, M";"Concentration, up to 1 hour";"(the petrified eye of a newt)You place a curse on a creature that you can see within range. Until the spell ends, you deal an extra 1d6 necrotic damage to the target whenever you hit it with an attack. Also, choose one ability when you cast the spell. The target has disadvantage on ability checks made with the chosen ability.<br> If the target drops to 0 hit points before this spell ends, you can use a bonus action on a subsequent turn of yours to curse a new creature. A <i>remove curse</i> cast on the target ends this spell early.<br> <b>At Higher Levels</b>: When you cast this spell using a spell slot of 3rd or 4th level, you can maintain your concentration on the spell for up to 8 hours. When you use a spell slot of 5th level or higher, you can maintain your concentration on the spell for up to 24 hours. ";"Warlock"
"1";"Illusory Script (ritual)";"1st level Illusion";"1 minute";"Touch";"S, M";"10 days";"(a lead-based ink worth at least 10 gp, which the spell consumes)You write on parchment, paper, or some other suitable writing material and imbue it with a potent illusion that lasts for the duration.<br> To you and any creatures you designate when you cast the spell, the writing appears normal, written in your hand, and conveys whatever meaning you intended when you wrote the text. To all others, the writing appears as if it were written in an unknown or magical script that is unintelligible. Alternatively, you can cause the writing to appear to be an entirely different message, written in a different hand and language, though the language must be one you know.<br> Should the spell be dispelled, the original script and the illusion both disappear.<br> A creature with truesight can read the hidden message. ";"Warlock"
