"Level";"Name";"Type";"Cast Time";"Range";"Components";"Duration";"Description";"Source"
"4";"Elemental Bane";"4th level Transmutation";"1 action";"90 feet";"V, S";"Concentration, up to 1 minute";"Choose one creature you can see within range, and choose one of the following damage types - acid, cold, fire, lightning, or thunder. The target must succeed on a Constitution saving throw or be affected by the spell for its duration. The first time each turn the affected target takes damage of the chosen type, the target takes an extra 2d6 damage of that type. Moreover, the target loses any resistance to that damage type until the spell ends.<br> <b>At Higher Levels</b>: When you cast this spell using a spell slot of 5th level or higher, you can target one additional creature for each slot level above 4th. The creatures must be within 30 feet of each other when you target them.";"Warlock (XGE)"
"4";"Evard's Black Tentacles";"4th level Conjuration";"1 action";"90 feet";"V, S, M";"Concentration, up to 1 minute";"(a piece of tentacle from a giant octopus or a giant squid)Squirming, ebony tentacles fill a 20-foot square on ground that you can see within range. For the duration, these tentacles turn the ground in the area into difficult terrain.<br> When a creature enters the affected area for the first time on a turn or starts its turn there, the creature must succeed on a Dexterity saving throw or take 3d6 bludgeoning damage and be restrained by the tentacles until the spell ends. A creature that starts its turn in the area and is already restrained by the tentacles takes 3d6 bludgeoning damage.<br> A creature restrained by the tentacles can use its action to make a Strength or Dexterity check (its choice) against your spell save DC. On a success, it frees itself. ";"Warlock (Great Old One)"
"4";"Fire Shield";"4th level Evocation";"1 action";"Self";"V, S, M";"10 minutes";"(a bit of phosphorous or a firefly)Thin and wispy flames wreathe your body for the duration, shedding bright light in a 10-foot radius and dim light for an additional 10 feet. You can end the spell early by using an action to dismiss it.<br> The flames provide you with a warm shield or a chill shield, as you choose. The warm shield grants you resistance to cold damage, and the chill shield grants you resistance to fire damage.<br> In addition, whenever a creature within 5 feet of you hits you with a melee attack, the shield erupts with flame. The attacker takes 2d8 fire damage from a warm shield, or 2d8 cold damage from a cold shield. ";"Warlock (Fiend)"
"4";"Greater Invisibility";"4th level Illusion";"1 action";"Touch";"V, S";"Concentration, up to 1 minute";"You or a creature you touch becomes invisible until the spell ends. Anything the target is wearing or carrying is invisible as long as it is on the target's person.";"Warlock (Archfey)"
"4";"Guardian of Faith";"4th level Conjuration";"1 action";"30 feet";"V";"8 hours";"A Large spectral guardian appears and hovers for the duration in an unoccupied space of your choice that you can see within range. The guardian occupies that space and is indistinct except for a gleaming sword and shield emblazoned with the symbol of your deity.<br> Any creature hostile to you that moves to a space within 10 feet of the guardian for the first time on a turn must succeed on a Dexterity saving throw. The creature takes 20 radiant damage on a failed save, or half as much damage on a successful one. The guardian vanishes when it has dealt a total of 60 damage. ";"Warlock (Celestial)"
"4";"Hallucinatory Terrain";"4th level Illusion";"10 minutes";"300 feet";"V, S, M";"24 hours";"(a stone, a twig, and a bit of green plant)You make natural terrain in a 150-foot cube in range look, sound, and smell like some other sort of natural terrain. Thus, open fields or a road can be made to resemble a swamp, hill, crevasse, or some other difficult or impassable terrain. A pond can be made to seem like a grassy meadow, a precipice like a gentle slope, or a rock-strewn gully like a wide and smooth road. Manufactured structures, equipment, and creatures within the area aren't changed in appearance.<br> The tactile characteristics of the terrain are unchanged, so creatures entering the area are likely to see through the illusion. If the difference isn't obvious by touch, a creature carefully examining the illusion can attempt an Intelligence (Investigation) check against your spell save DC to disbelieve it. A creature who discerns the illusion for what it is, sees it as a vague image superimposed on the terrain. ";"Warlock"
"4";"Phantasmal Killer";"4th level Illusion";"1 action";"120 feet";"V, S";"Concentration, up to 1 minute";"You tap into the nightmares of a creature you can see within range and create an illusory manifestation of its deepest fears, visible only to that creature. The target must make a Wisdom saving throw. On a failed save, the target becomes frightened for the duration. At the end of each of the target's turns before the spell ends, the target must succeed on a Wisdom saving throw or take 4d10 psychic damage. On a successful save, the spell ends.<br> <b>At Higher Levels</b>: When you cast this spell using a spell slot of 5th level or higher, the damage increases by 1d10 for each slot level above 4th. ";"Warlock (Hexblade)"
"4";"Shadow of Moil";"4th level Necromancy";"1 action";"Self";"V, S, M";"Concentration, up to 1 minute";"(an undead eyeball encased in a gem worth at least 150 gp)Flame-like shadows wreathe your body until the spell ends, causing you to become heavily obscured to others. The shadows turn dim light within 10 feet of you into darkness, and bright light in the same area to dim light.<br> Until the spell ends, you have resistance to radiant damage. In addition, whenever a creature within 10 feet of you hits you with an attack, the shadows lash out at that creature, dealing it 2d8 necrotic damage.";"Warlock (XGE)"
"4";"Sickening Radiance";"4th level Evocation";"1 action";"120 feet";"V, S";"Concentration, up to 10 minutes";"Dim, greenish light spreads within a 30-foot-radius sphere centered on a point you choose within range. The light spreads around corners, and it lasts until the spell ends.<br> When a creature moves into the spell's area for the first time on a turn or starts its turn there, that creature must succeed on a Constitution saving throw or take 4d10 radiant damage, and it suffers one level of exhaustion and emits a dim, greenish light in a 5-foot radius. This light makes it impossible for the creature to benefit from being invisible. The light and any levels of exhaustion caused by this spell go away when the spell ends.";"Warlock (XGE)"
"4";"Staggering Smite";"4th level Evocation";"1 bonus action";"Self";"V";"Concentration, up to 1 minute";"The next time you hit a creature with a melee weapon attack during this spell's duration, your weapon pierces both body and mind, and the attack deals an extra 4d6 psychic damage to the target. The target must make a Wisdom saving throw. On a failed save, it has disadvantage on attack rolls and ability checks, and can't take reactions, until the end of its next turn.";"Warlock (Hexblade)"
"4";"Summon Aberration";"4th-level conjuration";"1 action";"90 feet";"V, S, M";"Concentration, up to 1 hour";"(a pickled tentacle and an eyeball in a platinum inlaid vial worth at least 400 gp)You call forth an aberrant spirit. It manifests in an unoccupied space that you can see within range. This corporeal form uses the Aberrant Spirit stat block. When you cast the spell, choose Beholderkin, Slaad, or Star Spawn. The creature resembles an aberration of that kind, which determines certain traits in its stat block. The creature disappears when it drops to 0 hit points or when the spell ends.<br>The creature is an ally to you and your companions. In combat, the creature shares your initiative count, but it takes its turn immediately after yours. It obeys your verbal commands (no action required by you). If you don't issue any, it take the Dodge action and uses its move to avoid danger.<br><b>At Higher Levels</b>: When you cast this spell using a spell slot of 5th level or higher, use the higher level wherever the spell's level appears on the stat block.";"Warlock (TCE)"
"4";"Summon Greater Demon";"4th level Conjuration";"1 action";"60 feet";"V, S, M";"Concentration, up to 1 hour";"(a vial of blood from a humanoid killed within the past 24 hours)You utter foul words, summoning one demon from the chaos of the Abyss. You choose the demon's type, which must be one of challenge rating 5 or lower, such as a shadow demon or a barlgura. The demon appears in an unoccupied space you can see within range, and the demon disappears when it drops to 0 hit points or when the spell ends.<br> Roll initiative for the demon, which has its own turns. When you summon it and on each of your turns thereafter, you can issue a verbal command to it (requfring no action on your part), telling it what it must do on its next turn. If you issue no command, it spends its turn attacking any creature within reach that has attacked it.<br> At the end of each of the demon's turns, it makes a Charisma saving throw. The demon has disadvantage on this saving throw if you say its true name. On a failed save, the demon continues to obey you. On a successful save, your control of the demon ends for the rest of the duration, and the demon spends its turns pursuing and attacking the nearest non-demons to the best of its ability. If you stop concentrating on the spell before it reaches its full duration, an uncontrolled demon doesn't disappear for 1d6 rounds if it still has hit points.<br> As part of casting the spell, you can form a circle on the ground with the blood used as a material component. The circle is large enough to encompass your space. While the spell lasts, the summoned demon can't cross the circle or harm it, and it can't target anyone within it. Using the material component in this manner consumes it when the spell ends.<br> <b>At Higher Levels</b>: When you cast this spell using a spell slot of 5th level or higher, the challenge rating increases by 1 for each slot level above 4th.";"Warlock (XGE)"
"4";"Wall of Fire";"4th level Evocation";"1 action";"120 feet";"V, S, M";"Concentration, up to 1 minute";"(a small piece of phosphorus)You create a wall of fire on a solid surface within range. You can make the wall up to 60 feet long, 20 feet high, and 1 foot think, or a ringed wall up to 20 feet in diameter, 20 feet high, and 1 foot think. The wall is opaque and lasts for the duration.<br> When the wall appears, each creature within its area must make a Dexterity saving throw. On a failed save, a creature takes 5d8 fire damage, or half as much damage on a successful save.<br> One side of the wall, selected by you when you cast this spell, deals 5d8 fire damage to each creature that ends its turn within 10 feet of that side or inside the wall. A creature takes the same damage when it enters the wall for the first time on a turn or ends its turn there. The other side of the wall deals no damage.<br> <b>At Higher Levels</b>: When you cast this spell using a spell slot of 5th level or higher, the damage increases by 1d8 for each slot level above 4th. ";"Warlock (Celestial)(Fiend)"
"4";"Stone Shape";"4th level Transmutation";"1 action";"Touch";"V, S, M";"Instantaneous";"(soft clay, which must be worked into roughly the desired shape of the stone object)You touch a stone object of Medium size or smaller or a section of stone no more than 5 feet in any dimension and form it into any shape that suits your purpose. So, for example, you could shape a large rock into a weapon, idol, or coffer, or make a small passage through a wall, as long as the wall is less than 5 feet thick. You could also shape a stone door or its frame to seal the door shut. The object you create can have up to two hinges and a latch, but finer mechanical detail isn't possible.";"Warlock (Dao)"
"4";"Greater Invisibility";"4th level Illusion";"1 action";"Touch";"V, S";"Concentration, up to 1 minute";"You or a creature you touch becomes invisible until the spell ends. Anything the target is wearing or carrying is invisible as long as it is on the target's person.";"Warlock (Djinni)"
"4";"Fire Shield";"4th level Evocation";"1 action";"Self";"V, S, M";"10 minutes";"(a bit of phosphorous or a firefly)Thin and wispy flames wreathe your body for the duration, shedding bright light in a 10-foot radius and dim light for an additional 10 feet. You can end the spell early by using an action to dismiss it.<br> The flames provide you with a warm shield or a chill shield, as you choose. The warm shield grants you resistance to cold damage, and the chill shield grants you resistance to fire damage.<br> In addition, whenever a creature within 5 feet of you hits you with a melee attack, the shield erupts with flame. The attacker takes 2d8 fire damage from a warm shield, or 2d8 cold damage from a cold shield. ";"Warlock (Efreeti)"
"4";"Control Water";"4th level Transmutation";"1 action";"300 feet";"V, S, M";"Concentration, up to 10 minutes";"(a drop of water and a pinch of dust)Until the spell ends, you control any freestanding water inside an area you choose that is a cube up to 100 feet on a side. You can choose from any of the following effects when you cast this spell. As an action on your turn, you can repeat the same effect or choose a different one.<br> <b>Flood</b>: You cause the water level of all standing water in the area to rise by as much as 20 feet. If the area includes a shore, the flooding water spills over onto dry land.<br> If you choose an area in a large body of water, you instead create a 20-foot tall wave that travels from one side of the area to the other and then crashes down. Any Huge or smaller vehicles in the wave's path are carried with it to the other side. Any Huge or smaller vehicles struck by the wave have a 25 percent chance of capsizing.<br> The water level remains elevated until the spell ends or you choose a different effect. If this effect produced a wave, the wave repeats on the start of your next turn while the flood effect lasts.<br> <b>Part Water</b>: You cause water in the area to move apart and create a trench. The trench extends across the spell's area, and the separated water forms a wall to either side. The trench remains until the spell ends or you choose a different effect. The water then slowly fills in the trench over the course of the next round until the normal water level is restored.<br> <b>Redirect Flow</b>: You cause flowing water in the area to move in a direction you choose, even if the water has to flow over obstacles, up walls, or in other unlikely directions. The water in the area moves as you direct it, but once it moves beyond the spell's area, it resumes its flow based on the terrain conditions. The water continues to move in the direction you chose until the spell ends or you choose a different effect.<br> <b>Whirlpool</b>: This effect requires a body of water at least 50 feet square and 25 feet deep. You cause a whirlpool to form in the center of the area. The whirlpool forms a vortex that is 5 feet wide at the base, up to 50 feet wide at the top, and 25 feet tall. Any creature or object in the water and within 25 feet of the vortex is pulled 10 feet toward it. A creature can swim away from the vortex by making a Strength (Athletics) check against your spell save DC.<br> When a creature enters the vortex for the first time on a turn or starts its turn there, it must make a Strength saving throw. On a failed save, the creature takes 2d8 bludgeoning damage and is caught in the vortex until the spell ends. On a successful save, the creature takes half damage, and isn't caught in the vortex. A creature caught in the vortex can use its action to try to swim away from the vortex as described above, but has disadvantage on the Strength (Athletics) check to do so.<br> The first time each turn that an object enters the vortex, the object takes 2d8 bludgeoning damage, this damage occurs each round it remains in the vortex.";"Warlock (Fathomless)"
"4";"Summon Elemental";"4th-level conjuration";"1 action";"90 feet";"V, S, M";"Concentration, up to 1 hour";"(air, a pebble, ash, and water inside a crystal vial worth at least 400 gp)You call forth an elemental spirit. It manifests in an unoccupied space that you can see within range. This corporeal form uses the Elemental Spirit stat block. When you cast the spell, choose an element: Air, Earth, Fire, or Water. The creature resembles a bipedal form wreathed in the chosen element, which determines certain traits in its stat block. The creature disappears when it drops to 0 hit points or when the spell ends.<br>The creature is an ally to you and your companions. In combat, the creature shares your initiative count, but it takes its turn immediately after yours. It obeys your verbal commands (no action required by you). If you don't issue any, it takes the Dodge action and uses its move to avoid danger.<br><b>At Higher Levels</b>: When you cast this spell using a spell slot of 5th level or higher, use the higher level wherever the spell's level appears in the stat block.";"Warlock (Fathomless)"
"4";"Phantasmal Killer";"4th level Illusion";"1 action";"120 feet";"V, S";"Concentration, up to 1 minute";"You tap into the nightmares of a creature you can see within range and create an illusory manifestation of its deepest fears, visible only to that creature. The target must make a Wisdom saving throw. On a failed save, the target becomes frightened for the duration. At the end of each of the target's turns before the spell ends, the target must succeed on a Wisdom saving throw or take 4d10 psychic damage. On a successful save, the spell ends.<br> <b>At Higher Levels</b>: When you cast this spell using a spell slot of 5th level or higher, the damage increases by 1d10 for each slot level above 4th. ";"Warlock (Genie)"
"4";"Control Water";"4th level Transmutation";"1 action";"300 feet";"V, S, M";"Concentration, up to 10 minutes";"(a drop of water and a pinch of dust)Until the spell ends, you control any freestanding water inside an area you choose that is a cube up to 100 feet on a side. You can choose from any of the following effects when you cast this spell. As an action on your turn, you can repeat the same effect or choose a different one.<br> <b>Flood</b>: You cause the water level of all standing water in the area to rise by as much as 20 feet. If the area includes a shore, the flooding water spills over onto dry land.<br> If you choose an area in a large body of water, you instead create a 20-foot tall wave that travels from one side of the area to the other and then crashes down. Any Huge or smaller vehicles in the wave's path are carried with it to the other side. Any Huge or smaller vehicles struck by the wave have a 25 percent chance of capsizing.<br> The water level remains elevated until the spell ends or you choose a different effect. If this effect produced a wave, the wave repeats on the start of your next turn while the flood effect lasts.<br> <b>Part Water</b>: You cause water in the area to move apart and create a trench. The trench extends across the spell's area, and the separated water forms a wall to either side. The trench remains until the spell ends or you choose a different effect. The water then slowly fills in the trench over the course of the next round until the normal water level is restored.<br> <b>Redirect Flow</b>: You cause flowing water in the area to move in a direction you choose, even if the water has to flow over obstacles, up walls, or in other unlikely directions. The water in the area moves as you direct it, but once it moves beyond the spell's area, it resumes its flow based on the terrain conditions. The water continues to move in the direction you chose until the spell ends or you choose a different effect.<br> <b>Whirlpool</b>: This effect requires a body of water at least 50 feet square and 25 feet deep. You cause a whirlpool to form in the center of the area. The whirlpool forms a vortex that is 5 feet wide at the base, up to 50 feet wide at the top, and 25 feet tall. Any creature or object in the water and within 25 feet of the vortex is pulled 10 feet toward it. A creature can swim away from the vortex by making a Strength (Athletics) check against your spell save DC.<br> When a creature enters the vortex for the first time on a turn or starts its turn there, it must make a Strength saving throw. On a failed save, the creature takes 2d8 bludgeoning damage and is caught in the vortex until the spell ends. On a successful save, the creature takes half damage, and isn't caught in the vortex. A creature caught in the vortex can use its action to try to swim away from the vortex as described above, but has disadvantage on the Strength (Athletics) check to do so.<br> The first time each turn that an object enters the vortex, the object takes 2d8 bludgeoning damage, this damage occurs each round it remains in the vortex.";"Warlock (Marid)"
"5";"Banishing Smite";"5th level Abjuration";"1 bonus action";"Self";"V";"Concentration, up to 1 minute";"The next time you hit a creature with a weapon attack before this spell ends, your weapon crackles with force, and the attack deals an extra 5d10 force damage to the target. Additionally, if this attack reduces the target to 50 hit points of fewer, you banish it. If the target is native to a different plane of existence than the one you're on, the target disappears, returning to its home plane. If the target is native to the plane you're on, the creature vanishes into a harmless demiplane. While there, the target is incapacitated. It remains there until the spell ends, at which point the tart reappears in the space it left or in the nearest unoccupied space if that space is occupied.";"Warlock (Hexblade)"
"5";"Contact Other Plane (ritual)";"5th level Divination";"1 minute";"Self";"V";"1 minute";"You mentally contact a demigod, the spirit of a long-dead sage, or some other mysterious entity from another plane. Contacting this extraplanar intelligence can strain or even break your mind. When you cast this spell, make a DC 15 Intelligence saving throw. On a failure, you take 6d6 psychic damage and are insane until you finish a long rest. While insane, you can't take actions, can't understand what other creatures say, can't read, and speak only in gibberish. A greater restoration spell cast on you ends this effect.<br> On a successful save, you can ask the entity up to five questions. You must ask your questions before the spell ends. The DM answers each question with one word, such as yes, no, maybe, never, irrelevant, unclear (if the entity doesn't know the answer to the question). If a one-word answer would be misleading, the DM might instead offer a short phrase as an answer. ";"Warlock"
"5";"Contagion";"5th level Necromancy";"1 action";"Touch";"V, S";"7 days";"Your touch inflicts disease. Make a melee spell attack against a creature within your reach. On a hit, you afflict the creature with a disease of your choice from any of the ones described below.<br> At the end of each of the target's turns, it must make a Constitution saving throw. After failing three of these saving throws, the disease's effects last for the duration, and the creature stops making these saves. After succeeding on three of these saving throws, the creature recovers from the disease, and the spell ends.<br> Since this spell induces a natural disease in its target, any effect that removes a disease or otherwise ameliorates a disease's effects apply to it.<br> <b>Blinding Sickness</b>: Pain grips the creature's mind, and its eyes turn milky white. The creature has disadvantage on Wisdom checks and Wisdom saving throws and is blinded.<br> <b>Filth Fever</b>: A raging fever sweeps through the creature's body. The creature has disadvantage on Strength checks, Strength saving throws, and attack rolls that use Strength.<br> <b>Flesh Rot</b>: The creature's flesh decays. The creature has disadvantage on Charisma checks and vulnerability to all damage.<br> <b>Mindfire</b>: The creature's mind becomes feverish. The creature has disadvantage on Intelligence checks and Intelligence saving throws, and the creature behaves as if under the effects of the confusion spell during combat.<br> <b>Seizure</b>: The creature is overcome with shaking. The creature has disadvantage on Dexterity checks, Dexterity saving throws, and attack rolls that use Dexterity.<br> <b>Slimy Doom</b>: The creature begins to bleed uncontrollably. The creature has disadvantage on Constitution checks and Constitution saving throws. In addition, whenever the creature takes damage, it is stunned until the end of its next turn. ";"Warlock (Undying)"
