"Level";"Name";"Type";"Cast Time";"Range";"Components";"Duration";"Description";"Source"
"2";"Ray of Enfeeblement";"2nd level Necromancy";"1 action";"60 feet";"V, S";"Concentration, up to 1 minute";"A black beam of enervating energy springs from your finger toward a creature within range. Make a ranged spell attack against the target. On a hit, the target deals only half damage with weapon attacks that use Strength until the spell ends.<br> At the end of each of the target's turns, it can make a Constitution saving throw against the spell. On a success, the spell ends. ";"Warlock"
"2";"Scorching Ray";"2nd level Evocation";"1 action";"120 feet";"V, S";"Instantaneous";"You create three rays of fire and hurl them at targets within range. You can hurl them at one target or several.<br> Make a ranged spell attack for each ray. On a hit, the target takes 2d6 fire damage.<br> <b>At Higher Levels</b>: When you cast this spell using a spell slot of 3rd level or higher, you create one additional ray for each slot level above 2nd. ";"Warlock (Fiend)"
"2";"Shadow Blade";"2nd level Illusion";"1 bonus action";"Self";"V, S";"Concentration, up to 1 minute";"You weave together threads of shadow to create a sword of solidified gloom in your hand. This magic sword lasts until the spell ends. It counts as a simple melee weapon with which you are proficient. It deals 2d8 psychic damage on a hit and has the finesse, light, and thrown properties (range 20/60). In addition, when you use the sword to attack a target that is in dim light or darkness, you make the attack roll with advantage.<br> If you drop the weapon or throw it, it dissipates at the end of the turn. Thereafter, while the spell persists, you can use a bonus action to cause the sword to reappear in your hand.<br> <b>At Higher Levels</b>: When you cast this spell using a 3rd- or 4th-level spell slot, the damage increases to 3d8. When you cast it using a 5th- or 6th-level spell slot, the damage increases to 4d8. When you cast it using a spell slot of 7th level or higher, the damage increases to 5d8.";"Warlock (XGE)"
"2";"Shatter";"2nd level Evocation";"1 action";"60 feet";"V, S, M";"Instantaneous";"(a chip of mica)A sudden loud ringing noise, painfully intense, erupts from a point of your choice within range. Each creature in a 10-foot-radius sphere centered on that point must make a Constitution saving throw. A creature takes 3d8 thunder damage on a failed save, or half as much damage on a successful one. A creature made of inorganic material such as stone, crystal, or metal has disadvantage on this saving throw.<br> A nonmagical object that isn't being worn or carried also takes the damage if it's in the spell's area.<br> <b>At Higher Levels</b>: When you cast this spell using a spell slot of or higher, the damage increases by 1d8 for each slot level above 2nd. ";"Warlock"
"2";"Silence (ritual)";"2nd level Illusion";"1 action";"120 feet";"V, S";"Concentration, up to 10 minutes";"For the duration, no sound can be created within or pass through a 20-foot-radius sphere centered on a point you choose within range. Any creature or object entirely inside the sphere is immune to thunder damage, and creatures are deafened while entirely inside it. Casting a spell that includes a verbal component is impossible there.";"Warlock (Undying)"
"2";"Spider Climb";"2nd level Transmutation";"1 action";"Touch";"V, S, M";"Concentration, up to 1 hour";"(a drop of bitumen and a spider)Until the spell ends, one willing creature you touch gains the ability to move up, down, and across vertical surfaces and upside down along ceilings, while leaving its hands free. The target also gains a climbing speed equal to its walking speed.";"Warlock"
"2";"Suggestion";"2nd level Enchantment ";"1 action";"30 feet";"V, M";"Concentration, up to 8 hours";"(a snake's tongue and either a bit of honeycomb or a drop of sweet oil)You suggest a course of activity (limited to a sentence or two) and magically influence a creature you can see within range that can hear and understand you. Creatures that can't be charmed are immune to this effect. The suggestion must be worded in such a manner as to make the course of action sound reasonable. Asking the creature to stab itself, throw itself onto a spear, immolate itself, or do some other obviously harmful act ends the spell.<br> The target must make a Wisdom saving throw. On a failed save, it purses the course of action you described to the best of its ability. The suggested course of action can continue for the entire duration. If the suggested activity can be completed in a shorter time, the spell ends when the subject finishes what it was asked to do.<br> You can also specify conditions that will trigger a special activity during the duration. For example, you might suggest that a knight five her warhorse to the first beggar she meets. If the condition isn't met before the spell expires, the activity isn't performed.<br> If you or any of your companions damage the target, the spell ends. ";"Warlock"
"2";"Spike Growth";"2nd level Transmutation";"1 action";"150 feet";"V, S, M";"Concentration, up to 10 minutes";"(seven sharp thorns or seven small twigs, each sharpened to a point)The ground in a 20-foot radius centered on a point within range twists and sprouts hard spikes and thorns. The area becomes difficult terrain for the duration. When a creature moves into or within the area, it takes 2d4 piercing damage for every 5 feet it travels.<br> The transformation of the ground is camouflaged to look natural. Any creature that can't see the area at the time the spell is case must make a Wisdom (Perception) check against your spell save DC to recognize the terrain as hazardous before entering it. ";"Warlock (Dao)"
"2";"Gust of Wind";"2nd level Evocation";"1 action";"Self (60-foot line)";"V, S, M";"Concentration, up to 1 minute";"(a legume seed)A line of strong wind 60 feet long and 10 feet wide blasts from you in a direction you choose for the spell's duration. Each creature that starts its turn in the line must succeed on a Strength saving throw or be pushed 15 feet away from you in a direction following the line.<br> Any creature in the line must spend 2 feet of movement for every 1 foot it moves when moving closer to you.<br> The gust disperses gas or vapor, and it extinguishes candles, torches, and similar unprotected flames in the area. It causes protected flames, such as those of lanterns, to dance wildly and has a 50 percent chance to extinguish them.<br> As a bonus action on each of your turns before the spell ends, you can change the direction in which the line blasts from you. ";"Warlock (Djinni)"
"2";"Scorching Ray";"2nd level Evocation";"1 action";"120 feet";"V, S";"Instantaneous";"You create three rays of fire and hurl them at targets within range. You can hurl them at one target or several.<br> Make a ranged spell attack for each ray. On a hit, the target takes 2d6 fire damage.<br> <b>At Higher Levels</b>: When you cast this spell using a spell slot of 3rd level or higher, you create one additional ray for each slot level above 2nd. ";"Warlock (Efreeti)"
"2";"Gust of Wind";"2nd level Evocation";"1 action";"Self (60-foot line)";"V, S, M";"Concentration, up to 1 minute";"(a legume seed)A line of strong wind 60 feet long and 10 feet wide blasts from you in a direction you choose for the spell's duration. Each creature that starts its turn in the line must succeed on a Strength saving throw or be pushed 15 feet away from you in a direction following the line.<br> Any creature in the line must spend 2 feet of movement for every 1 foot it moves when moving closer to you.<br> The gust disperses gas or vapor, and it extinguishes candles, torches, and similar unprotected flames in the area. It causes protected flames, such as those of lanterns, to dance wildly and has a 50 percent chance to extinguish them.<br> As a bonus action on each of your turns before the spell ends, you can change the direction in which the line blasts from you. ";"Warlock (Fathomless)"
"2";"Silence (Ritual)";"2nd level Illusion";"1 action";"120 feet";"V, S";"Concentration, up to 10 minutes";"For the duration, no sound can be created within or pass through a 20-foot-radius sphere centered on a point you choose within range. Any creature or object entirely inside the sphere is immune to thunder damage, and creatures are deafened while entirely inside it. Casting a spell that includes a verbal component is impossible there.";"Warlock (Fathomless)"
"2";"Phantasmal Force";"2nd level Illusion";"1 action";"60 feet";"V, S, M";"Concentration, up to 1 minute";"(A bit of fleece)You craft an illusion that takes root in the mind of a creature that you can see within range. The target must make an Intelligence saving throw. On a failed save, you create a phantasmal object, creature, or other visible phenomenon of your choice that is no larger than a 10-foot cube and that is perceivable only to the target for the duration. This spell has no effect on undead or constructs.<br> The phantasm includes sound, temperature, and other stimuli, also evident only to the creature.<br> The target can use its action to examine the phantasm with an Intelligence (Investigation) check against your spell save DC. If the check succeeds, the target realizes that the phantasm is an illusion, and the spell ends.<br> While a target is affected by the spell, the target treats the phantasm as if it were real. The target rationalizes any illogical outcomes from interacting with the phantasm. For example, a target attempting to walk across a phantasmal bridge that spans a chasm falls once it steps onto the bridge. If the target survives the fall, it still believes that the bridge exists and comes up with some other explanation for its fall - it was pushed, it slipped, or a strong wind might have knocked it off.<br> An affected target is so convinced of the phantasm's reality that it can even take damage from the illusion. A phantasm created to appear as a creature can attack the target. Similarly, a phantasm created to appear as fire, a pool of acid, or lava can burn the target. Each round on your turn, the phantasm can deal 1d6 psychic damage to the target if it is in the phantasm's area or within 5 feet of the phantasm, provided that the illusion is of a creature or hazard that could logically deal damage, such as by attacking. The target perceives the damage as a type appropriate to the illusion. ";"Warlock (Genie)"
"2";"Blur";"2nd level Illusion";"1 action";"Self";"V";"Concentration, up to 1 minute";"Your body becomes blurred, shifting and wavering to all who can see you. For the duration, any creature has disadvantage on attack rolls against you. An attacker is immune to this effect if it doesn't rely on sight, as with blindsight, or can see through illusions, as with truesight.";"Warlock (Marid)"
"3";"Blink";"3rd level Transmutation";"1 action";"Self";"V, S";"1 minute";"Roll a d20 at the end of each of your turns for the duration of the spell. On a roll of 11 or higher, you vanish from your current plane of existence and appear in the Ethereal Plane (the spell fails and the casting is wasted if you were already on that plane). At the start of you next turn, and when the spell ends if you are on the Ethereal Plane, you return to an unoccupied space of your choice that you can see within 10 feet of the space you vanished from. If no unoccupied space is available within that range, you appear in the nearest unoccupied space (chosen at random if more than one space is equally near). You can dismiss this spell as an action.<br> While on the Ethereal Plane, you can see and hear the plane you originated from, which is cast in shades of gray, and you can't see anything more than 60 feet away. You can only affect and be affected by other creatures on the Ethereal Plane. Creature that aren't there can't perceive you or interact with you, unless they have the ability to do so. ";"Warlock (Archfey)(Hexblade)"
"3";"Clairvoyance";"3rd level Divination";"10 minutes";"1 mile";"V, S, M";"Concentration, up to 10 minutes";"(a focus worth at least 100 gp, either a jeweled horn for hearing or a glass eye for scrying)You create an invisible sensor within range in a location familiar to you (a place you have visited or seen before) or in an obvious location that is unfamiliar to you (such as behind a door, around a corner, or in a grove of trees). The sensor remains in place for the duration, and it can't be attacked or otherwise interacted with. When you cast the spell, you choose seeing or hearing. You can use the chosen sense through the sensor as if you were in its space. As your action, you can switch between seeing and hearing. A creature that can see the sensor (such as a creature benefitting from see invisibility or truesight) sees a luminous, intangible orb about the size of your fist.<br> When you cast the spell, you choose seeing or hearing. You can use the chosen sense through the sensor as if you were in its space. As your action, you can switch between seeing and hearing. A creature that can see the sensor (such as a creature benefitting from see invisibility or truesight) sees a luminous, intangible orb about the size of your fist.<br> A creature that can see the sensor (such as a creature benefitting from <i>see invisibility</i> or truesight) sees a luminous, intangible orb about the size of your fist. ";"Warlock (Great Old One)"
"3";"Counterspell";"3rd level Abjuration";"1 reaction";"60 feet";"S";"Instantaneous";"You attempt to interrupt a creature in the process of casting a spell. If the creature is casting a spell of 3rd level or lower, its spell fails and has no effect. If it is casting a spell of 4th level or higher, make an ability check using your spellcasting ability. The DC equals 10 + the spell's level. On a success, the creature's spell fails and has no effect.<br> <b>At Higher Levels</b>: When you cast this spell using a spell slot of 4th level or higher, the interrupted spell has no effect if its level is less than or equal to the level of the spell slot you used. ";"Warlock"
"3";"Daylight";"3rd level Evocation";"1 action";"60 feet";"V, S";"1 hour";"A 60-foot-radius sphere of light spreads out from a point you choose within range. The sphere is bright light and sheds dim light for an additional 60 feet.<br> If you chose a point on an object you are holding or one that isn't being worn or carried, the light shines from the object with and moves with it. Completely covering the affected object with an opaque object, such as a bowl or a helm, blocks the light.<br> If any of this spell's area overlaps with an area of darkness created by a spell of or lower, the spell that created the darkness is dispelled. ";"Warlock"
"3";"Dispel Magic";"3rd level Abjuration";"1 action";"120 feet";"V, S";"Instantaneous";"Choose any creature, object, or magical effect within range. Any spell of 3rd level or lower on the target ends. For each spell of 4th level or higher on the target, make an ability check using your spellcasting ability. The DC equals 10 + the spell's level. On a successful check, the spell ends.<br> <b>At Higher Levels</b>: When you cast this spell using a spell slot of 4th level or higher, you automatically end the effects of a spell on the target if the spell's level is equal to or less than the level of the spell slot you used. ";"Warlock"
"3";"Elemental Weapon";"3rd level Transmutation";"1 action";"Touch";"V, S";"Concentration, up to 1 hour";"A nonmagical weapon you touch becomes a magic weapon. Choose one of the following damage types - acid, cold, fire, lightning, or thunder. For the duration, the weapon has a +1 bonus to attack rolls and deals an extra 1d4 damage of the chosen type when it hits.<br> <b>At Higher Levels</b>: When you cast this spell using a spell slot of 5th or 6th level, the bonus to attack rolls increases to +2 and the extra damage increases to 2d4. When you use a spell slot of 7th level or higher, the bonus increases to +3 and the extra damage increases to 3d4. ";"Warlock"
"3";"Enemies Abound";"3rd level Enchantment";"1 action";"120 feet";"V, S";"Concentration, up to 1 minute";"You reach into the mind of one creature you can see and force it to make an Intelligence saving throw. A creature automatically succeeds if it is immune to being frightened. On a failed save, the target loses the ability to distinguish friend from foe, regarding all creatures it can see as enemies until the spell ends. Each time the target takes damage, it can repeat the saving throw, ending the effect on itself on a success.<br> Whenever the affected creature chooses another creature as a target, it must choose the target at random from among the creatures it can see within range of the attack, spell, or other ability it's using. lf an enemy provokes an opportunity attack from the affected creature, the creature must make that attack if it is able to.";"Warlock (XGE)"
"3";"Fear";"3rd level Illusion";"1 action";"Self (30-foot cone)";"V, S, M";"Concentration, up to 1 minute";"(a white feather or the heart of a hen)You project a phantasmal image of a creature's worst fears. Each creature in a 30-foot cone must succeed on a Wisdom saving throw or drop whatever it is holding and become frightened for the duration.<br> While frightened by this spell, a creature must take the Dash action and move away from you by the safest available route on each of its turns, unless there is nowhere to move. If the creature ends its turn in a location where it doesn't have line of sight to you, the creature can make a Wisdom saving throw. On a successful save, the spell ends for that creature. ";"Warlock"
"3";"Feign Death (ritual)";"3rd level Necromancy";"1 action";"Touch";"V, S, M";"1 hour";"(a pinch of graveyard dirt)You touch a willing creature and put it into a cataleptic state that is indistinguishable from death.<br> For the spell's duration, or until you use an action to touch the target and dismiss the spell, the target appears dead to all outward inspection and to spells used to determine the target's status. The target is blinded and incapacitated, and its speed drops to 0. The target has resistance to all damage except psychic damage. If the target is diseased or poisoned when you cast the spell, or becomes diseased or poisoned while under the spell's effect, the disease and poison have no effect until the spell ends. ";"Warlock (Undying)"
"3";"Fireball";"3rd level Evocation";"1 action";"150 feet";"V, S, M";"Instantaneous";"(a tiny ball of bat guano and sulfur)A bright streak flashes from your pointing finger to a point you choose within range then blossoms with a low roar into an explosion of flame. Each creature in a 20-foot radius must make a Dexterity saving throw. A target takes 8d6 fire damage on a failed save, or half as much damage on a successful one.<br> The fire spreads around corners. It ignites flammable objects in the area that aren't being worn or carried.<br> <b>At Higher Levels</b>: When you cast this spell using a spell slot of 4th level or higher, the damage increases by 1d6 for each slot level above 3rd. ";"Warlock (Fiend)"
"3";"Fly";"3rd level Transmutation";"1 action";"Touch";"V, S, M";"Concentration, up to 10 minutes";"(a wing feather from any bird)You touch a willing creature. The target gains a flying speed of 60 feet for the duration. When the spell ends, the target falls if it is still aloft, unless it can stop the fall.<br> <b>At Higher Levels</b>: When you cast this spell using a spell slot of 4th level or higher, you can target one additional creature for each slot level above 3rd. ";"Warlock"
"3";"Gaseous Form";"3rd level Transmutation";"1 action";"Touch";"V, S, M";"Concentration, up to 1 hour";"(a bit of gauze and a wisp of smoke)You transform a willing creature you touch, along with everything it's wearing and carrying, into a misty cloud for the duration. The spell ends if the creature drops to 0 hit points. An incorporeal creature isn't affected.<br> While in this form, the target's only method of movement is a flying speed of 10 feet. The target can enter and occupy the space of another creature. The target has resistance to nonmagical damage, and it has advantage on Strength, Dexterity, and Constitution saving throws. The target can pass through small holes, narrow openings, and even mere cracks, though it treats liquids as though they were solid surfaces. The target can't fall and remains hovering in the air even when stunned or otherwise incapacitated.<br> While in the form of a misty cloud, the target can't talk or manipulate objects, and any objects it was carrying or holding can't be dropped, used, or otherwise interacted with. The target can't attack or cast spells. ";"Warlock"
"3";"Hunger of Hadar";"3rd level Conjuration";"1 action";"150 feet";"V, S, M";"Concentration, up to 1 minute";"(a pickled octopus tentacle)You open a gateway to the dark between the stars, a region infested with unknown horrors. A 20-foot-radius sphere of blackness and bitter cold appears, centered on a point with range and lasting for the duration. This void is filled with a cacophony of soft whispers and slurping noises that can be heard up to 30 feet away. No light, magical or otherwise, can illuminate the area, and creatures fully within the area are blinded.<br> The void creates a warp in the fabric of space, and the area is difficult terrain. Any creature that starts its turn in the area takes 2d6 cold damage. Any creature that ends its turn in the area must succeed on a Dexterity saving throw or take 2d6 acid damage as milky, otherworldly tentacles rub against it. ";"Warlock"
"3";"Hypnotic Pattern";"3rd level Illusion";"1 action";"120 feet";"S, M";"Concentration, up to 1 minute";"(a glowing stick of incense or a crystal vial filled with phosphorescent material)You create a twisting pattern of colors that weaves through the air inside a 30-foot cube within range. The pattern appears for a moment and vanishes. Each creature in the area who sees the pattern must make a Wisdom saving throw. On a failed save, the creature becomes charmed for the duration. While charmed by this spell, the creature is incapacitated and has a speed of 0.<br> The spell ends for an affected creature if it takes any damage or if someone else uses an action to shake the creature out of its stupor. ";"Warlock"
"3";"Intellect Fortress";"3rd-level abjuration";"1 action";"30 feet";"V";"Concentration, up to 1 hour";"For the duration, you or one willing creature you can see within range has resistance to psychic damage, as well as advantage on Intelligence, Wisdom, and Charisma saving throws.<br><b>At Higher Levels</b>: When you cast this spell using a spell slot of 4th level or higher, you can target one additional creature for each slot level above 3rd. The creatures must be within 30 feet of each other when you target them.";"Warlock (TCE)"
"3";"Magic Circle";"3rd level Abjuration";"1 minute";"10 feet";"V, S, M";"1 hour";"(holy water or powdered silver and iron worth at least 100 gp, which the spell consumes)You create a 10-foot-radius, 20-foot-tall cylinder of magical energy centered on a point on the ground that you can see within range. Glowing runes appear wherever the cylinder intersects with the floor or other surface.<br> Choose one or more of the following types of creatures - celestials, elementals, fey, fiends, or undead. The circle affects a creature of the chosen type in the following ways.<br> • The creature can't willingly enter the cylinder by nonmagical means. If the creature tries to use teleportation or interplanar travel to do so, it must first succeed on a Charisma saving throw.<br> • The creature has disadvantage on attack rolls against targets within the cylinder.<br> • Targets within the cylinder can't be charmed, frightened, or possessed by the creature. When you cast this spell, you can elect to cause its magic to operate in the reverse direction, preventing a creature of the specified type from leaving the cylinder and protecting targets outside it.<br> <b>At Higher Levels</b>: When you cast this spell using a spell slot of 4th level or higher, the duration increases by 1 hour for each slot level above 3rd. ";"Warlock"
